{
  "schema": "ihat://identity/owner-recovery-profile/v1",
  "id": "owner-recovery-profile/primary",
  "revision": 1,
  "created_at": "2026-08-31T00:00:00.000Z",
  "updated_at": "2026-08-31T00:00:00.000Z",
  "digest": "sha256:d22e5ad3f89fde411847892751ef3637ef617f094eeb5d61fc580bdf7650ef1b",
  "profile": "bip39-ed25519-v1",
  "mnemonic_language": "english",
  "mnemonic_word_count": 24,
  "entropy_bits": 256,
  "checksum_bits": 8,
  "seed_kdf": "pbkdf2-hmac-sha512",
  "seed_kdf_rounds": 2048,
  "signing_key_derivation": "sha512-domain-first-32",
  "signing_key_domain": "ihat-owner-recovery-ed25519-v1",
  "signing_algorithm": "ed25519",
  "authority_id": "owner-recovery-eb91fc3e6bae7c31e1f3734378752113f6a1df1740cbedcaa08a7fe7a59f6ead",
  "authority_device_id": "offline-owner-recovery-root",
  "key_id": "owner-recovery-key-eb91fc3e6bae7c31e1f3734378752113f6a1df1740cbedcaa08a7fe7a59f6ead",
  "key_fingerprint": "eb91fc3e6bae7c31e1f3734378752113f6a1df1740cbedcaa08a7fe7a59f6ead",
  "public_key_hex": "ca46d41a501099b0354e692b40794deab870c7d899afb3b806ebe6ea3e43d911"
}
